{
  "bundle_id": "bundle_fixture_2025_09_01",
  "country_id": "country_fixture",
  "bookmark_id": "bookmark_global_fracture_2025_09_01",
  "as_of": "2025-09-01T00:00:00Z",
  "manifest": {
    "schema_version": "1.1.0",
    "force_ledger_id": "force_ledger_fixture_2025_09_01",
    "country_id": "country_fixture",
    "bookmark_id": "bookmark_global_fracture_2025_09_01",
    "as_of": "2025-09-01T00:00:00Z",
    "status": "reconciled",
    "accounting_states": [
      "active",
      "committed",
      "in_transit",
      "training",
      "maintenance",
      "reserve",
      "stored",
      "under_construction",
      "damaged",
      "destroyed",
      "exported",
      "retired",
      "captured",
      "unknown"
    ],
    "scope": {
      "services": [
        "air_force"
      ],
      "components": [
        "active"
      ],
      "government_forces": [],
      "individualization_rule": "individualize_only_when_identity_changes_command_mission_loss_or_player_decision",
      "covered_domains": [
        "air"
      ],
      "excluded_force_ids": [],
      "exclusion_notes": [],
      "coverage_matrix": [
        {
          "coverage_id": "coverage_fixture_air",
          "service": "air_force",
          "domain": "air",
          "organization_depth": "decision_usable",
          "equipment_taxonomy": "decision_usable",
          "inventory": "decision_usable",
          "dispositions": "decision_usable",
          "maintenance": "decision_usable",
          "construction": "reconciled",
          "conservation": "decision_usable"
        }
      ]
    },
    "dataset_paths": {
      "organizations": "organizations.ndjson",
      "platforms": "platforms.ndjson",
      "equipment_types": "equipment_types.ndjson",
      "inventory": "inventory.ndjson",
      "deployments": "deployments.ndjson",
      "maintenance": "maintenance.ndjson",
      "construction": "construction.ndjson",
      "conservation": "conservation.ndjson",
      "facilities": "facilities.ndjson",
      "sources": "sources.ndjson",
      "contradictions": "contradictions.ndjson",
      "relationships": "relationships.ndjson"
    },
    "reconciliation": {
      "state": "balanced",
      "organization_records": 2,
      "platform_records": 1,
      "equipment_type_records": 1,
      "inventory_records": 2,
      "deployment_records": 1,
      "maintenance_records": 1,
      "construction_records": 1,
      "conservation_records": 1,
      "exact_quantity_records": 2,
      "range_quantity_records": 0,
      "unknown_quantity_records": 0,
      "open_conservation_exceptions": 0,
      "double_booking_exceptions": 0,
      "orphan_platform_records": 0,
      "orphan_organization_records": 0,
      "expired_records": 0,
      "relationship_records": 1
    },
    "conservation_policy": {
      "equation": "opening_plus_inflows_equals_closing_states_plus_outflows",
      "counting_units_are_not_interchangeable": true,
      "individuals_are_excluded_from_pools": true,
      "parent_totals_are_not_summed_with_children": true
    },
    "aggregation_policy": {
      "global_resolution": "service and command aggregates",
      "theater_resolution": "formations and operational pools",
      "mission_resolution": "individual executing and supporting platforms",
      "aggregation_preserves_quantity": true
    },
    "source_ids": [
      "source_fixture"
    ],
    "unknowns": [],
    "reviewed_at": "2025-09-01",
    "review_after": "2025-10-01",
    "acceptance": {
      "schema_valid": true,
      "internally_consistent": true,
      "research_complete": true,
      "decision_usable": true,
      "simulation_ready": false,
      "untested_claims": [
        "Fixture does not test simulation runtime integration."
      ],
      "blockers": [
        "Runtime integration is outside the schema fixture."
      ]
    }
  },
  "organizations": [
    {
      "organization_id": "organization_fixture_air_force",
      "country_id": "country_fixture",
      "controller_id": "country_fixture",
      "name": "Fixture Air Force",
      "service": "air_force",
      "component": "active",
      "organization_kind": "service_command",
      "echelon": "service_command",
      "headquarters_location_id": "location_fixture_air_base",
      "personnel": {
        "authorized": {
          "kind": "unknown",
          "unit": "person"
        },
        "assigned": {
          "kind": "unknown",
          "unit": "person"
        },
        "deployable": {
          "kind": "unknown",
          "unit": "person"
        }
      },
      "readiness": {
        "state": "ready",
        "basis": "official_aggregate",
        "limiting_factors": []
      },
      "mobilization": {
        "status": "standing",
        "authority_id": null,
        "minimum_delay_hours": 0,
        "equipment_pool_ids": []
      },
      "roles": [
        "air_operations"
      ],
      "temporal_validity": {
        "valid_from": "2025-01-01",
        "valid_to": null,
        "as_of": "2025-09-01T00:00:00Z",
        "observed_at": "2025-08-15",
        "review_after": "2025-10-01"
      },
      "provenance": {
        "evidence_state": "observed",
        "confidence": "high",
        "source_ids": [
          "source_fixture"
        ],
        "method": "fixture"
      },
      "display_parent_organization_id": null,
      "relationship_record_ids": [
        "relationship_fixture_air_force_squadron_administrative_control"
      ]
    },
    {
      "organization_id": "organization_fixture_squadron",
      "country_id": "country_fixture",
      "controller_id": "country_fixture",
      "name": "1st Fixture Squadron",
      "service": "air_force",
      "component": "active",
      "organization_kind": "formation",
      "echelon": "squadron",
      "headquarters_location_id": "location_fixture_air_base",
      "personnel": {
        "authorized": {
          "kind": "unknown",
          "unit": "person"
        },
        "assigned": {
          "kind": "unknown",
          "unit": "person"
        },
        "deployable": {
          "kind": "unknown",
          "unit": "person"
        }
      },
      "readiness": {
        "state": "ready",
        "basis": "official_aggregate",
        "limiting_factors": []
      },
      "mobilization": {
        "status": "standing",
        "authority_id": null,
        "minimum_delay_hours": 0,
        "equipment_pool_ids": [
          "inventory_fixture_active",
          "inventory_fixture_maintenance"
        ]
      },
      "roles": [
        "fighter_operations"
      ],
      "inventory_record_ids": [
        "inventory_fixture_active",
        "inventory_fixture_maintenance"
      ],
      "temporal_validity": {
        "valid_from": "2025-01-01",
        "valid_to": null,
        "as_of": "2025-09-01T00:00:00Z",
        "observed_at": "2025-08-15",
        "review_after": "2025-10-01"
      },
      "provenance": {
        "evidence_state": "observed",
        "confidence": "high",
        "source_ids": [
          "source_fixture"
        ],
        "method": "fixture"
      },
      "display_parent_organization_id": "organization_fixture_air_force",
      "relationship_record_ids": [
        "relationship_fixture_air_force_squadron_administrative_control"
      ]
    }
  ],
  "equipment_types": [
    {
      "equipment_type_id": "equipment_fixture_fighter",
      "display_name": "Fixture Fighter",
      "taxonomy": {
        "domain": "air",
        "category": "multirole_fighter",
        "entity_kind": "platform",
        "family": "Fixture",
        "model": "F1",
        "variant": null
      },
      "origin_country_ids": [
        "country_fixture"
      ],
      "manufacturer_ids": [
        "producer_fixture"
      ],
      "roles": [
        "air_superiority"
      ],
      "individualization": {
        "supported": true,
        "default_research_resolution": "formation_pool",
        "reason": "Tail identity is optional unless it changes mission, command, or loss accounting."
      },
      "crew_requirements": {
        "operating_crew": {
          "kind": "exact",
          "value": 1,
          "unit": "person"
        },
        "support_personnel": {
          "kind": "unknown",
          "unit": "person"
        }
      },
      "mobility": {
        "mobility_kind": "fixed_wing",
        "self_deploying": true,
        "strategic_lift_required": false
      },
      "support_dependency_types": [
        "crew",
        "fuel",
        "runway",
        "maintenance_facility",
        "munition"
      ],
      "measured_characteristics": [],
      "temporal_validity": {
        "valid_from": "2025-01-01",
        "valid_to": null,
        "as_of": "2025-09-01T00:00:00Z",
        "observed_at": "2025-08-15",
        "review_after": "2026-09-01"
      },
      "provenance": {
        "evidence_state": "observed",
        "confidence": "high",
        "source_ids": [
          "source_fixture"
        ],
        "method": "fixture"
      },
      "ontology_id": "ontology_air_multirole_fighter",
      "parent_equipment_type_id": null,
      "counting_unit": "platform",
      "aggregation_rule": "parent_is_reconciliation_only_and_must_not_be_summed_with_children",
      "dependency_requirements": [
        {
          "dependency_id": "dependency_fixture_crew",
          "dependency_kind": "crew",
          "required_equipment_type_id": null,
          "required_capability_id": "capability_crew",
          "quantity": {
            "kind": "unknown",
            "unit": "capacity_unit",
            "counting_rule": "Fixture dependency quantity."
          },
          "substitution_allowed": true,
          "conditions": "Fixture requirement."
        },
        {
          "dependency_id": "dependency_fixture_fuel",
          "dependency_kind": "fuel",
          "required_equipment_type_id": null,
          "required_capability_id": "capability_fuel",
          "quantity": {
            "kind": "unknown",